Oversee and Govern (OV),"Privacy Officer/Privacy Compliance Manager (OV-LGA-002): Develops and oversees privacy compliance program and privacy program staff, supporting privacy compliance, governance/policy, and incident response needs of privacy and security executives and their teams. Click to view the Master KSA List
Legal Advice and Advocacy (LGA),,Click to return to the Table of Contents
,,OPM 732
KSA ID,KSA,
Knowledge,,
K0001,"Knowledge of computer networking concepts and protocols, and network security methodologies.  
K0002,"Knowledge of risk management processes (e.g., methods for assessing and mitigating risk). 
K0003,"Knowledge of laws, regulations, policies, and ethics as they relate to cybersecurity and privacy.  
K0004,Knowledge of cybersecurity and privacy principles.,
K0005,Knowledge of cyber threats and vulnerabilities. ,
K0006,Knowledge of specific operational impacts of cybersecurity lapses.,
K0008,Knowledge of applicable business processes and operations of customer organizations.,
K0066,Knowledge of Privacy Impact Assessments.,
K0168,"Knowledge of applicable laws, statutes (e.g., in Titles 10, 18, 32, 50 in U.S. Code), Presidential Directives, executive branch guidelines, and/or administrative/criminal legal guidelines and procedures. 
K0612,Knowledge of what constitutes a “threat” to a network.,
K0613,"Knowledge of who the organization’s operational planners are, how and where they can be contacted, and what are their expectations. 
K0614,"Knowledge of wireless technologies (e.g., cellular, satellite, GSM) to include the basic structure, architecture, and design of modern wireless communications systems. 
K0615,Knowledge of privacy disclosure statements based on current laws.,
,,
Skills,,
S0354,Skill in creating policies that reflect the business’s core privacy objectives.,
S0355,Skill in negotiating vendor agreements and evaluating vendor privacy practices.,
S0356,"Skill in communicating with all levels of management including Board members (e.g., interpersonal skills, approachability, effective listening skills, appropriate use of style and language for the audience).  
,,
Abilities,,
A0024,Ability to develop clear directions and instructional materials.,
A0033,"Ability to develop policy, plans, and strategy in compliance with laws, regulations, policies, and standards in support of organizational cyber activities. 
A0034,"Ability to develop, update, and/or maintain standard operating procedures (SOPs). 
A0104,Ability to select the appropriate implant to achieve operational goals.,
A0105,Ability to tailor technical and planning information to a customer’s level of understanding.,
A0110,Ability to monitor advancements in information privacy laws to ensure organizational adaptation and compliance.,
A0111,"Ability to work across departments and business units to implement organization’s privacy principles and programs, and align privacy objectives with security objectives.  
A0112,Ability to monitor advancements in information privacy technologies to ensure organizational adaptation and compliance.,
A0113,Ability to determine whether a security incident violates a privacy principle or legal standard requiring specific legal action.,
A0114,Ability to develop or procure curriculum that speaks to the topic at the appropriate level for the target.,
A0115,"Ability to work across departments and business units to implement organization’s privacy principles and programs, and align privacy objectives with security objectives. 
A0125,Ability to author a privacy disclosure statement based on current laws.,
